Indicator,Definition,Notes,Disclosure,References,Score,Justification,New disclosure?
Carbon emissions,Is the amount of carbon emitted (associated with the energy used) in building the model disclosed?,"Emissions should be reported in appropriate units, which most often will be tons of carbon dioxide emitted (tCO2). Emissions should be reported to a precision of one significant figure (e.g. 500 tCO2). No form of decomposition into compute phases is required, but it should be clear whether the reported emissions is for a single model run or includes additional runs, or hyperparameter tuning, or training other models like reward models, or other steps in the model development process that generate emissions.","Section 5.7 of StarCoder: may the source be with you! states:

StarCoderBase We report the carbon footprint (Lacoste et al., 2019) of training StarCoderBase. Based on the total number of GPU hours that training took (320,256) and an average power usage of 280W per GPU, this adds up to 89671.68 kWh of electricity consumed during the training process. Multiplied by the carbon intensity of the energy of the us-west-2 AWS location (0.15495 kgCO2e per kWh) and the average Power Usage Effectiveness of 1.2 across AWS datacenters, this results in 16.68 tonnes of CO2eq emitted.
StarCoder The fine-tuned model adds 3.5% of training time, which translates to an additional estimated emission of 0.58 tonnes of CO2eq.",https://arxiv.org/pdf/2305.06161.pdf,1,17.25tCO2,No
Broader environmental impact,Are any broader environmental impacts from building the model besides carbon emissions disclosed?,"While the most direct environmental impact of building a foundation model is the energy used and, therefore, the potential carbon emissions, there may be other environmental impacts. For example, these may include the use of other resources such as water for cooling data centers or metals for producing specialized hardware. We recognize that there does not exist an authoritative or consensus list of broader environmental factors. For this reason, we will award this point if there is a meaningful, though potentially incomplete, discussion of broader environmental impact.","Section 1.2.5 Supporting resources and funding of The BigCode Project Governance Card also includes comparisons of the Power Usage Effectiveness and Carbon Intensity of both the ServiceNow Montreal, and the Hugging Face AWS datacenters.","https://arxiv.org/pdf/2312.03872.pdf

https://huggingface.co/datasets/bigcode/governance-card ",1,"The disclosure of Power Usage Effectiveness and locations of each of the datacenters (ServiceNow Montreal vs. Hugging Face AWS) allows for understanding.  By comparing the PUE values of different datacenters, one can gauge which datacenter is more energy-efficient and therefore has a smaller environmental footprint for the same amount of compute.",No
Model stages,Are all stages in the model development process disclosed?,"Stages refer to each identifiable step that constitutes a substantive change to the model during the model building process. We recognize that different developers may use different terminology for these stages, or conceptualize the stages differently. We will award this point if there is a clear and complete description of these stages.","See section 5 Model Training from the paper ""StarCoder: May the source be with you!"" for details",https://www.bigcode-project.org/docs/about/timeline/,1,Paper provides extensive details on model stages,No
Model objectives,"For all stages that are described, is there a clear description of the associated learning objectives or a clear characterization of the nature of this update to the model?","We recognize that different developers may use different terminology for these stages, or conceptualize the stages differently. We will award this point if there is a clear description of the update to the model related to each stage, whether that is the intent of the stage (e.g. making the model less harmful), a mechanistic characterization (e.g. minimizing a specific loss function), or an empirical assessment (e.g. evaluation results conducted before and after the stage).","As described in the paper ""StarCoder: may the source be with you!"", the StarCoder takes several important steps towards a safe open-access model release, including an improved PII redaction pipeline and a novel attribution tracing tool, and make the StarCoder models publicly available under a more commercially viable version of the Open Responsible AI Model license.","https://www.bigcode-project.org/docs/about/mission/ 

See linked threads in https://www.bigcode-project.org/docs/about/timeline/

https://arxiv.org/pdf/2312.03872.pdf",1,"We trained a 15.5B parameter model with the same architecture as SantaCoder (Ben Allal et al., 2023). It is a
decoder-only Transformer with Multi-Query-Attention (MQA; Shazeer, 2019), and learned absolute positional
embeddings. We also apply Fill-in-the-Middle (FIM; Bavarian et al., 2022) transformations to the training
data, see Section 5.1. We used FlashAttention (Dao et al., 2022) to speed up the attention computation and
reduce its memory footprint, allowing us to scale to a 8K context length. To make FlashAttention work
with MQA during training, we simply expand the key and value before calling the attention kernel.",No
Core frameworks,Are the core frameworks used for model development disclosed?,"Examples of core frameworks include Tensorflow, PyTorch, Jax, Hugging Face Transformers, Seqio, T5X, Keras, SciKit, and Triton. If there are significant internal frameworks, there should be some description of their function and/or a reasonably similar publicly-available analogue. We recognize that there does not exist an authoritative or consensus list of core frameworks. For this reason, we will award this point if there is a meaningful, though potentially incomplete, list of major frameworks for the first version of the index.","See section 5.6 Multi-Node GPU Setup from the paper ""StarCoder: May the source be with you!"" for details","https://arxiv.org/pdf/2305.06161.pdf

All development code is public, see required libraries in https://github.com/bigcode-project",1,All frameworks are disclosed in public codebase including Megatron-LM.,No
Additional dependencies,"Are any dependencies required to build the model disclosed besides data, compute, and code?","For example, if the model depends on an external search engine, programmable APIs, or tools, this should be disclosed. We recognize that there is not widespread consensus regarding what constitutes key dependencies beyond the data, compute, and code. We will award this point only if developers give a reasonable best-effort description of any additional dependencies or make clear that no additional dependencies are required.",All development code is public,See required libraries in https://github.com/bigcode-project,1,All dependencies are disclosed in public codebase.,No
Mitigations for privacy,Are any steps the developer takes to mitigate the presence of PII in the data disclosed?,"Such steps might include identifying personal information in the training data, filtering specific datasets to remove personal information, and reducing the likelihood that models will output personal information. We will award this point if the developer reports that it does not take steps to mitigate the presence of PII in the data.","The project includes StarPII, an NER model trained to detect Personal Identifiable Information (PII) in code datasets. This model is used to mask PII in the bigcode large model training. Section 4 of the second document further presents a number of experiments that have been conducted to best handle PII.","ttps://huggingface.co/bigcode/starpii ; 

https://arxiv.org/pdf/2305.06161.pdf ",1,"The project includes StarPII, an NER model trained to detect Personal Identifiable Information (PII) in code datasets. This model is used to mask PII in the bigcode large model training. Section 4 of the second document further presents a number of experiments that have been conducted to best handle PII.",No
Mitigations for copyright,Are any steps the developer takes to mitigate the presence of copyrighted information in the data disclosed?,"Such steps might include identifying copyrighted data, filtering specific datasets to remove copyrighted data, and reducing the likelihood that models will output copyrighted information. We will award this point if the developer reports that it does take steps to mitigate the presence of copyrighted information in the data.","StarCoder was trained on a subset of The Stack v1.2 dataset. This dataset has been filtered using a license detector to only include permissively licensed source code. Nevertheless, the license detector might have incorrectly classified a number of repositories. See Kocetkov et al. (2022) for more details on this license detection process. Besides, an opt-out process has been put in place if a copyright owner chooses to opt out from the dataset.",https://arxiv.org/pdf/2305.06161.pdf,1,"StarCoder was trained on a subset of The Stack v1.2 dataset. This dataset has been filtered using a license detector to only include permissively licensed source code. Nevertheless, the license detector might have incorrectly classified a number of repositories. See Kocetkov et al. (2022) for more details on this license detection process. Besides, an opt-out process has been put in place if a copyright owner chooses to opt out from the dataset.",No
Input modality,Are the input modalities for the model disclosed?,"Input modalities refer to the types or formats of information that the model can accept as input. Examples of input modalities include text, image, audio, video, tables, graphs.","Yes, this is explained in the model card, and in E.3 Improving Code Generation with Prompting in the paper ""StarCoder: May the source be with you"".","https://huggingface.co/bigcode/starcoder

https://arxiv.org/pdf/2305.06161.pdf",1,Code,No
Output modality,Are the output modalities for the model disclosed?,"Output modalities refer to the types or formats of information that the model can accept as output. Examples of output modalities include text, image, audio, video, tables, graphs.","Yes, this is explained in the model card, and in E.3 Improving Code Generation with Prompting in the paper ""StarCoder: May the source be with you"".","https://huggingface.co/bigcode/starcoder

https://arxiv.org/pdf/2305.06161.pdf",1,Code,No
Model components,Are all components of the model disclosed?,"Model components refer to distinct and identifiable parts of the model. We recognize that different developers may use different terminology for model components, or conceptualize components differently. Examples include: (i) For a text-to-image model, components could refer to a text encoder and an image encoder, which may have been trained separately. (ii) For a retrieval-augmented model, components could refer to a separate retriever module.","See section 5 Model training in the paper ""StarCoder: May the source be with you"".","https://huggingface.co/bigcode/starcoder

https://arxiv.org/pdf/2305.06161.pdf",1,"We trained a 15.5B parameter model with the same architecture as SantaCoder (Ben Allal et al., 2023). It is a
decoder-only Transformer with Multi-Query-Attention (MQA; Shazeer, 2019), and learned absolute positional
embeddings. We also apply Fill-in-the-Middle (FIM; Bavarian et al., 2022) transformations to the training
data, see Section 5.1. We used FlashAttention (Dao et al., 2022) to speed up the attention computation and
reduce its memory footprint, allowing us to scale to a 8K context length. To make FlashAttention work
with MQA during training, we simply expand the key and value before calling the attention kernel.",No
Model size,"For all components of the model, is the associated model size disclosed?","This information should be reported in appropriate units, which generally is the number of model parameters, broken down by named component. Model size should be reported to a precision of one significant figure (e.g. 500 billion parameters for text encoder, 20 billion parameters for image encoder).","See section 5 Model training in the paper ""StarCoder: May the source be with you"".","https://huggingface.co/bigcode/starcoder

https://arxiv.org/pdf/2305.06161.pdf",1,15.5B parameters,No
Model architecture,Is the model architecture disclosed?,"Model architecture is the overall structure and organization of a foundation model, which includes the way in which any disclosed components are integrated and how data moves through the model during training or inference. We recognize that different developers may use different terminology for model architecture, or conceptualize the architecture differently. We will award this point for any clear, though potentially incomplete, description of the model architecture.","See section 5.4 Model Architecture in the paper ""StarCoder: May the source be with you"".",https://arxiv.org/pdf/2305.06161.pdf,1,"We trained a 15.5B parameter model with the same architecture as SantaCoder (Ben Allal et al., 2023). It is a
decoder-only Transformer with Multi-Query-Attention (MQA; Shazeer, 2019), and learned absolute positional
embeddings. We also apply Fill-in-the-Middle (FIM; Bavarian et al., 2022) transformations to the training
data, see Section 5.1. We used FlashAttention (Dao et al., 2022) to speed up the attention computation and
reduce its memory footprint, allowing us to scale to a 8K context length. To make FlashAttention work
with MQA during training, we simply expand the key and value before calling the attention kernel.",No
Centralized model documentation,Is key information about the model included in a centralized artifact such as a model card?,"We recognize that different developers may share this information through different types of documentation, such as a system card or several clearly interrelated documents. We will award this point for the disclosure of any such centralized artifact that provides key information typically included in a model card, though the artifact may be longer-form than a standard model card (e.g. a technical report).",See the model card on Hugging Face and the paper introducing the model,"https://huggingface.co/bigcode/starcoder

https://arxiv.org/abs/2305.06161 ",1,Model card is available,No
External model access protocol,Is a protocol for granting external entities access to the model disclosed?,"A model access protocol refers to the steps, requirements, and considerations involved in granting authorized model access to external entities. We will award this point if the developer discloses key details of its protocol, including (i) where external entities can request access (e.g. via an access request form); (ii) explicit criteria for selecting external entities; and (iii) a transparent decision on whether access has been granted within a specified, reasonable period of time.","Users are presented with the following: ""You need to agree to share your contact information to access this model
This repository is publicly accessible, but you have to accept the conditions to access its files and content.
Model License Agreement

Please read the BigCode OpenRAIL-M license agreement before accepting it.""",https://huggingface.co/bigcode/starcoder,1,"Clear model access protocol involving access form, license agreement, and public repository for weights.",No
Blackbox external model access,Is black box model access provided to external entities?,"Black box model access refers to the ability to query the model with inputs and receive outputs, potentially without further access. Examples of external entities that might be granted access include researchers, third-party auditors, and regulators. We will award this point for any reasonable access level: direct access to the model weights, an interface to query the model, a developer-mediated access program where developers can inspect requests, etc. Developers may receive this point even if there are rate-limits on the number of queries permitted to an external entity and restrictions on the external entities that are permitted access, insofar as these limits and restrictions are transparent.","There is a demo to generate text and code with the following StarCoder models:

StarCoderPlus: A finetuned version of StarCoderBase on English web data, making it strong in both English text and code generation.
StarCoderBase: A code generation model trained on 80+ programming languages, providing broad language coverage for code generation tasks.
StarCoder: A finetuned version of StarCoderBase specifically focused on Python, while also maintaining strong performance on other programming languages.",https://huggingface.co/spaces/bigcode/bigcode-playground,1,Weights are available.,No
Full external model access,Is full model access provided to external entities?,"Full model access refers to the ability to access the model via the release of model weights. Developers may receive this point even if there are some restrictions on the external entities that are permitted access (e.g. geographic restrictions), insofar as these restrictions are transparent (e.g. via some high-level description of who has been granted access to the foundation model).",These are available on Hugging Face,"http://hf.co/bigcode

e.g. https://huggingface.co/bigcode/starcoder and https://huggingface.co/bigcode/starcoderbase (15B models) + we have 1, 3, 7b models as well",1,Weights are available.,No
Capabilities description,Are the model's capabilities described?,"Capabilities refer to the specific and distinctive functions that the model can perform. We recognize that different developers may use different terminology for capabilities, or conceptualize capabilities differently. We will award this point for any clear, but potentially incomplete, description of the multiple capabilities.",The model card on Hugging Face describes the intended use as a code generation and fill-in-the-middle model.,"https://huggingface.co/bigcode/starcoder#generation 

https://huggingface.co/bigcode/starcoder#fill-in-the-middle ",1,The model card on Hugging Face describes the intended use as a code generation and fill-in-the-middle model.,No
Capabilities demonstration,Are the model’s capabilities demonstrated?,"Demonstrations refer to illustrative examples or other forms of showing the model's capabilities that are legible or understandable for the general public, without requiring specific technical expertise. We recognize that different developers may use different terminology for capabilities, or conceptualize capabilities differently. We will award this point for clear demonstrations of multiple capabilities.","Appendix D, E, and F of the StarCoder: may the source be with you! paper, includes illustrative examples of StarCoder as a technical assistant, along with additional evaluations and qualitative examples for other use cases. Collectively, these provide the reader with insights into the model's capabilities.",https://arxiv.org/pdf/2305.06161.pdf,1,"Appendix D, E, and F of the StarCoder: may the source be with you! paper, includes illustrative examples of StarCoder as a technical assistant, along with additional evaluations and qualitative examples for other use cases. Collectively, these provide the reader with insights into the model's capabilities.",No
Evaluation of capabilities,"Are the model’s capabilities rigorously evaluated, with the results of these evaluations reported prior to or concurrent with the initial release of the model?","Rigorous evaluations refer to precise quantifications of the model's behavior in relation to its capabilities. We recognize that capabilities may not perfectly align with evaluations, and that different developers may associate capabilities with evaluations differently. We will award this point for clear evaluations of multiple capabilities. For example, this may include evaluations of world knowledge, reasoning, state tracking or other such proficiencies. Or it may include the measurement of average performance (e.g. accuracy, F1) on benchmarks for specific tasks (e.g. text summarization, image captioning). We note that evaluations on standard broad-coverage benchmarks are likely to suffice for this indicator, though they may not if the model's capabilities are presented as especially unusual such that standard evaluations will not suffice.","Section 6 of the StarCoder: may the source be with you! paper, includes details of evaluations completed prior to the model being released, including Python evaluation, HumanEval and MBPP, DS-1000 Python Data Science Benchmarks, ODEX Open-Domain Coding Benchmark, Multi-Language Evaluation with MultiPL-E, Asleeps at the keyboard security benchmark, Fill in the Middle benchmark.",https://arxiv.org/pdf/2305.06161.pdf,1,"Evaluation on Code LM Eval Harness, which includes several public capability benchmarks (e.g. HumanEval, DS-1000)",No
External reproducibility of capabilities evaluation,Are the evaluations of the model’s capabilities reproducible by external entities?,"For an evaluation to be reproducible by an external entity, we mean that the associated data is either (i) publicly available or (ii) described sufficiently such that a reasonable facsimile can be constructed by an external entity. In addition, the evaluation protocol should be sufficiently described such that if the evaluation is reproduced, any discrepancies with the developer's results can be resolved. We recognize that there does not exist an authoritative or consensus standard for what is required for an evaluation to be deemed externally reproducible. Evaluations on standard benchmarks are assumed to be sufficiently reproducible for the purposes of this index. We will award this point for reproducibility of multiple disclosed evaluations. In the event that an evaluation is not reproducible, a justification by the model developer for why it is not possible for the evaluation to be made reproducible may be sufficient to score this point.","StarCoder is made available as an Open LLM via the Hugging Face platform. Hugging Face have included StarCoder in the Open LLM Leaderboard, where it is evaluated against 119 evaluated tasks.","https://huggingface.co/bigcode/starcoder

https://huggingface.co/datasets/open-llm-leaderboard/details_bigcode__starcoder

https://huggingface.co/datasets/open-llm-leaderboard/details_bigcode__starcoder/blob/main/results_2023-08-28T21%3A18%3A29.614335.json",1,"Evaluation on Code LM Eval Harness, which includes several public capability benchmarks (e.g. HumanEval, DS-1000)",No
Third party capabilities evaluation,Are the model’s capabilities evaluated by third parties?,"By third party, we mean entities that are significantly or fully independent of the developer. We will award this point if (i) a third party has conducted an evaluation of model capabilities, (ii) the results of this evaluation are publicly available, and (iii) these results are disclosed or referred to in the developer’s materials.",StarCoder has been included in several benchmark studies conducted independently of the BigCode developers.,"https://openreview.net/forum?id=pPjZIOuQuF 

https://arxiv.org/abs/2402.02037 ",1,External evaluation of capabilities conducted by UCSD researcher on RepoBench.,No
Limitations description,Are the model's limitations disclosed?,"Limitations refer to the specific and distinctive functions that the model cannot perform (e.g. the model cannot answer questions about current events as it only contains data up to a certain time cutoff, the model is not very capable when it comes to a specific application). We recognize that different developers may use different terminology for limitations, or conceptualize limitations differently. We will award this point for any clear, but potentially incomplete, description of multiple limitations.","Section 10.2 of StarCoder: may the source be with you! paper includes disclosures of the model's limitations, as well as additional limitations including: Dataset and data licensing, Opt-out process, PII detection, Malicious code, English-only evaluations, Code attribution tools.",https://arxiv.org/pdf/2305.06161.pdf,1,"Extensive limitation section in paper, spanning limitations of model as well as broader development process.",No
Limitations demonstration,Are the model’s limitations demonstrated?,"Demonstrations refer to illustrative examples or other forms of showing the limitations that are legible or understandable for the general public, without requiring specific technical expertise. We recognize that different developers may use different terminology for limitations, or conceptualize the limitations differently. We will award this point for clear demonstrations of multiple limitations.","Appendix D, E, and F of the StarCoder: may the source be with you! paper, includes illustrative examples of StarCoder as a technical assistant, along with additional evaluations and qualitative examples for other use cases. Collectively, these provide the reader with insights into the model's limitations.",https://arxiv.org/pdf/2305.06161.pdf,0,"While some demonstrations are provided, they do not clearly demonstrate limitations of the model.",No
